{
  "airfoil_sections": [
    {
      "coefficients_lower": [
        -0.13411949093207398,
        -0.05736428794815644,
        -0.026942980085123837,
        -0.05008025548141216,
        0.0009660792385340535,
        -0.011931451366098689
      ],
      "coefficients_upper": [
        0.21809304448357872,
        0.24098933919371995,
        0.3018703693035897,
        0.210222748466081,
        0.292418700357157,
        0.269483355187719
      ],
      "eta": 0.0,
      "parameterization": "CST"
    },
    {
      "coefficients_lower": [
        -0.13411949093207398,
        -0.05736428794815644,
        -0.026942980085123837,
        -0.05008025548141216,
        0.0009660792385340535,
        -0.011931451366098689
      ],
      "coefficients_upper": [
        0.21809304448357872,
        0.24098933919371995,
        0.3018703693035897,
        0.210222748466081,
        0.292418700357157,
        0.269483355187719
      ],
      "eta": 0.25,
      "parameterization": "CST"
    },
    {
      "coefficients_lower": [
        -0.13411949093207398,
        -0.05736428794815644,
        -0.026942980085123837,
        -0.05008025548141216,
        0.0009660792385340535,
        -0.011931451366098689
      ],
      "coefficients_upper": [
        0.21809304448357872,
        0.24098933919371995,
        0.3018703693035897,
        0.210222748466081,
        0.292418700357157,
        0.269483355187719
      ],
      "eta": 0.5,
      "parameterization": "CST"
    },
    {
      "coefficients_lower": [
        -0.13411949093207398,
        -0.05736428794815644,
        -0.026942980085123837,
        -0.05008025548141216,
        0.0009660792385340535,
        -0.011931451366098689
      ],
      "coefficients_upper": [
        0.21809304448357872,
        0.24098933919371995,
        0.3018703693035897,
        0.210222748466081,
        0.292418700357157,
        0.269483355187719
      ],
      "eta": 0.75,
      "parameterization": "CST"
    },
    {
      "coefficients_lower": [
        -0.13411949093207398,
        -0.05736428794815644,
        -0.026942980085123837,
        -0.05008025548141216,
        0.0009660792385340535,
        -0.011931451366098689
      ],
      "coefficients_upper": [
        0.21809304448357872,
        0.24098933919371995,
        0.3018703693035897,
        0.210222748466081,
        0.292418700357157,
        0.269483355187719
      ],
      "eta": 1.0,
      "parameterization": "CST"
    }
  ],
  "control_surfaces": [
    {
      "chord_fraction": 0.12,
      "eta_end": 1.0,
      "eta_start": 0.88,
      "hinge_axis": [
        0.0,
        1.0,
        0.0
      ],
      "name": "aileron",
      "surface": "wing"
    },
    {
      "chord_fraction": 1.0,
      "eta_end": 1.0,
      "eta_start": 0.4,
      "hinge_axis": [
        0.0,
        0.0,
        1.0
      ],
      "name": "vane",
      "surface": "duct_jet"
    },
    {
      "chord_fraction": 1.0,
      "eta_end": 1.0,
      "eta_start": 0.4,
      "hinge_axis": [
        0.0,
        -1.0,
        0.0
      ],
      "name": "vane",
      "surface": "duct_jet"
    },
    {
      "chord_fraction": 1.0,
      "eta_end": 1.0,
      "eta_start": 0.4,
      "hinge_axis": [
        0.0,
        0.0,
        -1.0
      ],
      "name": "vane",
      "surface": "duct_jet"
    },
    {
      "chord_fraction": 1.0,
      "eta_end": 1.0,
      "eta_start": 0.4,
      "hinge_axis": [
        0.0,
        1.0,
        0.0
      ],
      "name": "vane",
      "surface": "duct_jet"
    }
  ],
  "design_id": "sha256:64c65d4008e224fa5c50a33a49e534435a960e334b2d1f29156a57c75d943d78",
  "mesh_topology": {
    "chordwise_panels": 8,
    "spanwise_panels_per_section": 6,
    "wake_model": "frozen"
  },
  "planform": {
    "span": 1.0628798195068672,
    "stations": [
      {
        "chord": 0.17714663658447782,
        "dihedral": 0.0,
        "eta": 0.0,
        "sweep_qc": 0.0,
        "twist": 0.0
      },
      {
        "chord": 0.17714663658447782,
        "dihedral": 0.0,
        "eta": 0.25,
        "sweep_qc": 0.0,
        "twist": 0.0
      },
      {
        "chord": 0.17714663658447782,
        "dihedral": 0.0,
        "eta": 0.5,
        "sweep_qc": 0.0,
        "twist": 0.0
      },
      {
        "chord": 0.17714663658447782,
        "dihedral": 0.0,
        "eta": 0.75,
        "sweep_qc": 0.0,
        "twist": 0.0
      },
      {
        "chord": 0.17714663658447782,
        "dihedral": 0.0,
        "eta": 1.0,
        "sweep_qc": 0.0,
        "twist": 0.0
      }
    ]
  },
  "propulsion_bemt": {
    "blade_stations": [
      {
        "chord": 0.014473615862551538,
        "r_over_R": 0.42,
        "twist": 29.61435515011651
      },
      {
        "chord": 0.015454564354071968,
        "r_over_R": 0.4683333333333333,
        "twist": 27.010164382462793
      },
      {
        "chord": 0.01643550589464554,
        "r_over_R": 0.5166666666666666,
        "twist": 24.799899345992173
      },
      {
        "chord": 0.017416352638934856,
        "r_over_R": 0.565,
        "twist": 22.90577140271379
      },
      {
        "chord": 0.017191836959874807,
        "r_over_R": 0.6133333333333333,
        "twist": 21.267860081829397
      },
      {
        "chord": 0.016307717376040934,
        "r_over_R": 0.6616666666666666,
        "twist": 19.83967983874127
      },
      {
        "chord": 0.015412831367874615,
        "r_over_R": 0.71,
        "twist": 18.58484971865764
      },
      {
        "chord": 0.01448625875884953,
        "r_over_R": 0.7583333333333333,
        "twist": 17.47462623656851
      },
      {
        "chord": 0.013478757605159706,
        "r_over_R": 0.8066666666666666,
        "twist": 16.486081433601672
      },
      {
        "chord": 0.012284320225642157,
        "r_over_R": 0.855,
        "twist": 15.600753783416316
      },
      {
        "chord": 0.010679200154369855,
        "r_over_R": 0.9033333333333333,
        "twist": 14.80364337506177
      },
      {
        "chord": 0.0081224962876816,
        "r_over_R": 0.9516666666666667,
        "twist": 14.082457851051018
      },
      {
        "chord": 0.0,
        "r_over_R": 1.0,
        "twist": 13.427041758485208
      }
    ],
    "disk_radius": 0.1015,
    "reference_rpm": 12211.259999999998
  },
  "reference_frame": "aetherion_body_frd",
  "schema_version": "1.1.0",
  "units": {
    "angle": "deg",
    "length": "m"
  }
}
